<?xml version ="1.0" encoding="UTF-8"?>
<!DOCTYPE AUCTIONSET SYSTEM "auctionfile.dtd"> 
<!-- The Id must be an integer which represents the domain id-->
<AUCTIONSET ID="5">
  <!-- global part is the default for all auctions -->
  <!-- overwritten by rule specific configuration -->
  <GLOBAL>
    <!-- how long the auctions are active - value in seconds-->
    <PREF NAME="Duration">10000</PREF>

    <!-- How often they should be run - value in seconds -->
    <PREF NAME="Interval">30</PREF>
  </GLOBAL>
  <AUCTION ID="5" RESOURCE_SET="ResourceSet_1" RESOURCE_ID="router_1">
    <ACTION NAME="two_auction_generalized" DEFAULT="true">
    <PREF NAME="Bandwidth01" TYPE="Float32">10</PREF>
    <PREF NAME="Bandwidth02" TYPE="Float32">22</PREF>
    <PREF NAME="ReservePrice01" TYPE="Float64">0.15</PREF>
    <PREF NAME="ReservePrice02" TYPE="Float64">0.5</PREF>
    <PREF NAME="MaxValue01" TYPE="Float64">0.5</PREF>
    <PREF NAME="MaxValue02" TYPE="Float64">0.9</PREF>
    </ACTION>

	<FIELD NAME="quantity">
	<TEMPLATE_FIELD OBJECT_TYPE = "BID" TEMPLATE_TYPE = "DATA"></TEMPLATE_FIELD>
	<TEMPLATE_FIELD OBJECT_TYPE = "ALLOCATION" TEMPLATE_TYPE = "DATA"></TEMPLATE_FIELD>
	</FIELD>
    
	<FIELD NAME="unitprice">
	<TEMPLATE_FIELD OBJECT_TYPE = "BID" TEMPLATE_TYPE = "DATA"></TEMPLATE_FIELD>
	<TEMPLATE_FIELD OBJECT_TYPE = "ALLOCATION" TEMPLATE_TYPE = "DATA"></TEMPLATE_FIELD>
	</FIELD>

  </AUCTION>
</AUCTIONSET>
